{
  "kind": "project",
  "schema_version": 2,
  "example": true,
  "canonicalization": "feltwillow-canonical-json-v1",
  "project_id": "big-lessons-little-tales",
  "profile_option": "zero_cost",
  "website": {
    "primary": "plain_static",
    "origin": "https://feltwillow-example.pages.dev",
    "locale_prefixes": true
  },
  "modules": {
    "astro": "spec_only",
    "ghost": "spec_only",
    "plain_static": "enabled",
    "spotify_hosted": "enabled",
    "independent_rss": "spec_only",
    "youtube": "spec_only"
  },
  "podcast_authority": "spotify",
  "safety": {
    "production_enabled": false,
    "allow_remote_writes": false
  },
  "newsletter": "disabled",
  "commerce": "disabled",
  "ai_disclosure": {
    "text": "All voices in this podcast are AI-generated.",
    "spoken": true
  },
  "public_contact_email": "jei.leal.r@gmail.com",
  "public_contact_acknowledged": true,
  "service_inventory": {
    "path": "tests/fixtures/ops/service-inventory.strict-zero.example.json",
    "sha256": "aa48673efcc421b10ffabfddf93a9a2cc09a160ef50e4aa2114cd5eb331a5637"
  }
}
